record_id,visit_date,institution_name,postal_code,address,interviewed,residents_number,residents_bedroom,vehicle,normal_ilpi,caracterizao_da_ilpi_complete,nurse_aux,weekly_hours_na,days_per_month_na,nurse_tech,weekly_hours_nt,days_per_month_nt,nurse,weekly_hours_n,days_per_month_n,physiotherapist,weekly_hours_physio,days_per_month_physio,nutritionist,weekly_hours_nutrit,days_per_month_nutrit,psicologist,weekly_hours_psicol,days_per_month_psicol,physician,weekly_hours_physician,days_per_month_physician,occup_therapist,weekly_hours_occup,days_per_month_occup,caregiver,weekly_hours_caregiver,days_per_month_caregiver,other_health_prof,other_health_prof_1,other_health_prof_2,other_prof,other_prof_1,other_prof_2,w_h_other_health_prof,w_h_other_health_prof_1,w_h_other_health_prof_2,d_p_month_oth_health_prof,d_p_month_oth_health_prof1,d_p_month_oth_health_prof2,housekeeping,weekly_hours_housekeep,days_per_month_housekeep,staff,weekly_hours_staff,days_per_month_staff,employment_relatioship___1,employment_relatioship___2,employment_relatioship___3,physio_program___1,physio_program___2,physio_program___3,physio_program___4,activities___1,activities___2,physio_instructions,no_orientation,profissionais_da_ilpi_complete,secutiry_system,security_device_type___1,security_device_type___2,security_device_type___3,security_device_type___4,security_device_type___5,safety_device_availability,safety_device,safety_device_working,reason_1,lighting,ventilation,painting_color,room_access___1,room_access___2,room_access___3,bathroom_access___1,bathroom_access___2,bathroom_access___3,other_areas___1,other_areas___2,other_areas___3,cafeteria___1,cafeteria___2,cafeteria___3,epi_use,segurana_e_ambiente_complete,medication_val_date,violeted_pakage,medicine_refrigerator,refrigerator_temp_log,medication_register,medication_register_type___1,medication_register_type___2,medication_register_type___3,psico_drugs_segregation,psico_drugs_storage,medication_manipulation___1,medication_manipulation___2,medication_manipulation___3,medication_manipulation___4,medication_manipulation___5,medication_manipulation___6,medication_manipulation___7,other_meditation_manip,organizao_da_farmcia_complete,dirty_clothing_segregation,dirty_clothing_change,servio_lavanderia_complete,trash_recicling,trash_container___1,trash_container___2,trash_container___3,trash_container___4,trash_container___5,gerenciamento_resduos_complete,sunbathing,visiting_area,social_area,ambient_music,menu,semanal_menu,recreation_list,recreation_type___1,recreation_type___2,recreation_type___3,recreation_type___4,recreation_type___5,recreation_type___6,recreation_type___7,medical_record___1,medical_record___2,medical_record___3,medical_record___4,medical_record___5,medical_record___6,admission_file_signed___1,admission_file_signed___2,admission_file_signed___3,admission_file_signed___4,admission_file_signed___5,admission_file_signed___6,patient_bath___1,patient_bath___2,patient_bath___3,patient_bath___4,patient_bath___5,patient_bath___6,imc_index___1,imc_index___2,imc_index___3,imc_index___4,imc_index___5,imc_index___6,physical_cont_record___1,physical_cont_record___2,physical_cont_record___3,physical_cont_record___4,physical_cont_record___5,physical_cont_record___6,mem_scale___1,mem_scale___2,mem_scale___3,mem_scale___4,mem_scale___5,mem_scale___6,mem_prev_actions___1,mem_prev_actions___2,mem_prev_actions___3,mem_prev_actions___4,mem_prev_actions___5,mem_prev_actions___6,pain_register___1,pain_register___2,pain_register___3,pain_register___4,pain_register___5,pain_register___6,meem_care_actions___1,meem_care_actions___2,meem_care_actions___3,meem_care_actions___4,meem_care_actions___5,meem_care_actions___6,rehab_activities_register___1,rehab_activities_register___2,rehab_activities_register___3,rehab_activities_register___4,rehab_activities_register___5,rehab_activities_register___6,rehab_activities___1,rehab_activities___2,rehab_activities___3,rehab_activities___4,rehab_activities___5,rehab_activities___6,processos_de_cuidado_complete,ubs,ubs_1,ubs_2,upa,upa_1,upa_2,internship,internship_institution,internship_institution_2,internship_institution_3,internship_institution_4,internship_course,internship_course_2,internship_course_3,internship_course_4,regulao_complete,comments,comments_type,encerramento_complete
1,"2024-10-29 09:19",2,74971451,"Rua José Leão Souza Filho, 122, Jardim Riviera, Aparecida de Goiânia","Gleiciane Maria da Silva - responsável técnica",72,2,1,1,2,0,,,0,,,0,,,2,30,16.25,1,8,4.375,1,4,2.125,2,1,0.5,0,,,16,44,23.875,1,0,0,"terapeuta holístico",,,4,,,2.125,,,10,44,23.875,3,44,23.875,1,1,1,1,1,1,0,0,1,2,,2,1,0,1,1,1,0,2,,,,1,1,1,1,1,0,1,1,0,1,1,0,1,1,1,1,2,1,2,1,1,1,0,1,1,1,"Armário com chave da farmácia",0,0,0,0,0,0,1,"Auxiliar de depósito",2,2,1,2,1,1,0,0,1,1,2,1,1,1,2,2,,1,0,0,1,0,1,1,1,0,1,1,1,1,1,1,0,0,0,0,0,0,1,1,1,1,1,1,0,0,0,0,0,1,0,0,0,0,0,1,0,0,0,0,0,1,0,0,0,0,0,1,0,0,0,0,0,1,0,0,0,0,0,0,1,1,1,1,1,1,0,0,0,0,0,2,"UBS Jardim Riviera (não atendem as demandas da ILPI)",,,"UPA Buriti/ UPA Brasicom; UPA Flamboyant",,,1,"Colégio Suldamérica","Não se aplica","Não se aplica","Não se aplica","Técnico de Enfermagem","Não se aplica","Não se aplica","Não se aplica",2,1,"As insatisfações com o município são enormes. Parece que estão mendigando. Poderiam disponibilizar um médico para seguimento e insumos (p. ex. luvas, gazes, soro fisiológico).",2
2,"2024-10-29 13:38",3,74980050,"Rua Onze de Maio, S/N, Setor Central, Aparecida de Goiânia","Luciane Aparecida das Chagas - coproprietária, diretora, secretária",19,2,2,1,2,0,,,0,,,1,24,13,1,18,9.75,1,1,0.5,0,,,1,1,0.5,0,,,6,44,23.875,0,0,0,,,,,,,,,,2,44,23.875,3,40,21.625,1,0,1,1,1,1,0,1,0,2,,2,1,0,1,1,0,0,2,,,,2,2,1,0,0,0,0,0,1,1,1,1,1,1,0,2,2,1,1,1,2,1,1,1,0,2,,0,0,0,0,1,0,0,,2,2,1,2,1,0,0,0,1,0,2,1,1,1,1,2,,1,0,0,1,0,1,1,0,0,1,1,1,1,1,1,0,0,0,0,0,0,1,1,1,1,1,1,0,0,0,0,0,1,0,0,0,0,0,1,0,0,0,0,0,1,0,0,0,0,0,1,0,0,0,0,0,1,0,0,0,0,0,1,0,0,0,0,0,1,0,0,0,0,0,2,"Centro de Atendimento Ambulatorial",,,"UPA Brasicom",,,1,Genotec-Genoma,"Não se aplica","Não se aplica","Não se aplica","Técnico de Enfermagem","Não se aplica","Não se aplica","Não se aplica",2,1," - Solicitam da equipe de pesquisa para a organização da farmácia.  - A relação com a SMS é um problema.  - A obrigatoriedade do acompanhante nos serviços de saúde é complicada; difícil.  - Desconhece os editais de financiamento dos Conselhos de Idosos.",2
3,"2024-11-05 13:19",4,74913510,"Rua Igarapé, S/N, Qd. 40, Lt. 02 a 04, Vila Alzira, Aparecida de Goiânia","Eleny Lopes Rosa - Responsável Técnico",34,2,1,1,2,1,44,23.875,0,,,0,,,0,,,2,20,10.875,0,,,1,1,0.5,0,,,7,44,23.875,1,0,0,"Assistente Social",,,30,,,16.25,,,10,44,23.875,1,44,23.875,1,0,1,1,1,1,0,1,0,2,,2,1,0,1,1,1,0,2,,,,2,2,1,0,1,0,1,1,1,1,1,1,1,1,0,2,2,2,2,2,,1,0,1,1,2,,0,0,1,0,0,0,0,,2,1,1,2,1,1,0,0,1,0,2,1,1,1,2,2,,1,0,0,0,0,0,1,1,0,1,1,1,1,1,1,0,0,0,0,0,0,1,1,1,0,0,1,0,0,0,0,0,1,0,0,0,0,0,1,0,0,0,0,0,1,0,0,0,0,0,1,0,0,0,0,0,1,0,0,0,0,0,1,0,0,0,0,0,1,0,0,0,0,0,2,"UBS Cândido de Queiroz",,,"UPA Flamboyant",,,1,"Universidade Paulista"," Centro Universitário Alfredo Nasser",SESC,"Não se aplica","Fisioterapia e Nutrição","Psicologia e Medicina","Cuidadores de idosos","Não se aplica",2,1," - Há irregularidades no fornecimento de fraldas geriátricas pela Prefeitura. É insuficiente. Os idosos utilizam 10 fraldas por dia.  - Há falta de cuidadores para os idosos internados em serviços de saúde. A ILPI contrata cuidadores nos casos que o idoso não tenha familiar/acompanhante.  - Dificuldades na relação com os serviços de saúde, em especial as UPAS.  - O idoso tem o direito ao acompanhante, mas não é obrigação.",2
4,"2024-11-05 07:50",1,74920784,"Rua 15 de março, Qd. 3, Lt. 4, S/N, Parque Flamboyant, Aparecida de Goiânia","Antônio Gonçalves da Silva - responsável",18,2,2,2,2,,,,,,,2,1,0.5,,,,,,,,,,1,1,0.5,,,,0,,,0,0,0,,,,,,,,,,2,40,21.625,,,,0,1,0,0,0,0,1,0,0,,,2,2,0,0,0,0,0,2,,,,1,2,1,0,0,0,0,0,0,0,1,0,0,1,0,,2,,,2,,,0,0,0,,,0,0,0,0,0,0,0,,2,,,2,2,0,0,0,0,0,2,1,1,1,2,2,,1,0,0,0,0,0,1,0,0,0,0,0,0,0,0,0,0,0,0,0,0,0,0,0,0,0,0,0,0,0,0,0,0,0,0,0,0,0,0,0,0,0,0,0,0,0,0,0,0,0,0,0,0,0,0,0,0,0,0,0,0,0,0,0,0,0,0,0,0,0,0,0,0,0,2,"UBS Santa Luzia",N/A,N/A,"IPA Geraldo Magela",N/A,N/A,2,,,,,,,,,2,1,"Omissão do Estado",2
5,"2024-10-11 14:30",5,74943150,"Avenida Graça Aranha, Qd. E, Lt. 15, Nova Brasília, Aparecida de Goiânia","Ludmila Ozan - responsável técnica",41,2,1,1,2,0,,,1,44,23.875,0,,,1,7,3.75,2,8,4.375,0,,,0,,,0,,,8,44,23.875,0,0,0,,,,,,,,,,4,44,23.875,2,44,23.875,1,0,1,1,1,1,0,1,0,2,,2,2,0,0,0,0,0,2,,,,1,2,1,1,0,0,0,0,1,1,1,0,1,1,0,1,2,1,1,1,2,1,1,1,0,1,"Armário com chave",1,0,0,0,0,0,0,,2,1,1,2,1,1,0,0,1,0,2,1,1,1,2,2,,1,0,0,0,0,0,0,1,1,0,0,0,0,0,1,0,0,0,0,0,1,0,0,0,0,0,1,0,0,0,0,0,1,0,0,0,0,0,1,0,0,0,0,0,1,0,0,0,0,0,1,0,0,0,0,0,1,0,0,0,0,0,1,0,0,0,0,0,1,0,0,0,0,0,2,"UBS Bairro Cardoso",,,"UPA Buriti Sereno",,,1,UNIP,"Não se aplica","Não se aplica","Não se aplica",Psicologia,"Não se aplica","Não se aplica","Não se aplica",2,1,"Falta articulação com a rede de atenção à saúde, em especial com a Atenção Primária.  Fragilidade financeira (poucos funcionários).",2
